{
  "$schema": "https://resource.rahmanef.com/slice-schema.json",
  "slug": "landing-sections",
  "version": "0.4.0",
  "category": "content",
  "kind": "ui",
  "title": "Landing Sections",
  "description": "Landing-page composition: admin CRUD over the section list PLUS (v0.4.0) a config-driven public section renderer library. Ships a pure reducer (LANDING_UPSERT auto-shifts sibling order; LANDING_DELETE closes the gap) + LandingProvider store adapter + admin LandingView/LandingEditorView built on the shared CRUD primitives, plus a per-section LandingSectionShell (background image + custom Tailwind className overlay + scroll-reveal). NEW: sections/ renderers (StatsSection, TestimonialsSection, FaqSection, PricingSection, NewsletterSection, CustomSection) read `LandingSection.config` JSON over template defaults so content stays dashboard-controlled, plus parse-config helpers (parseConfigBadge/parseConfigField). Sections carry { kind, order, title, subtitle, enabled, imageUrl, imageRatio, bgImageUrl, className, config (JSON) } with up/down reorder arrows. Consumers map each `kind` to a section (shipped for stats/testimonials/pricing/faq/newsletter/custom) or their own renderer wrapped in <LandingSectionShell>. Lifted from the _templates fleet `_shared/landing` (2026-06-11); SSOT for all 7 rr website templates.",
  "namespace": "@/features/landing-sections",
  "frontend": {
    "slicePath": "frontend/slices/landing-sections",
    "configExport": "landingSectionsFeature"
  },
  "convex": {
    "tablesExport": "",
    "schemaPath": "",
    "rootPaths": []
  },
  "deps": {
    "npm": [
      "lucide-react@^0.400.0",
      "embla-carousel-autoplay@^8.6.0",
      "next@^15"
    ],
    "shadcn": [
      "accordion",
      "badge",
      "button",
      "card",
      "carousel",
      "dialog",
      "input",
      "label",
      "select",
      "switch",
      "table",
      "textarea"
    ],
    "env": [],
    "peers": []
  },
  "registers": [],
  "audit": [],
  "license": "MIT",
  "tags": [
    "admin",
    "landing",
    "cms",
    "sections",
    "crud",
    "renderer"
  ],
  "previews": [
    {
      "component": "LandingSectionShell",
      "kind": "scenarios",
      "scenarios": [
        {
          "id": "hero-only",
          "title": "Hero only",
          "description": "Single hero band"
        },
        {
          "id": "hero-features",
          "title": "Hero + features",
          "description": "Hero followed by a features grid"
        },
        {
          "id": "full-page",
          "title": "Full page",
          "description": "Hero + features + CTA stacked, scaled to fit"
        }
      ],
      "seed": "3 seed sections (hero/features/cta) rendered by local mini-blocks wrapped in LandingSectionShell, scaled in a fixed-height frame"
    }
  ],
  "contract": {
    "requires": {
      "deps": [
        {
          "npm": "lucide-react",
          "range": "^0.400.0"
        },
        {
          "npm": "embla-carousel-autoplay",
          "range": "^8.6.0"
        },
        {
          "npm": "next",
          "range": "^15"
        }
      ]
    },
    "provides": {
      "tools": [
        "landing-sections.list",
        "landing-sections.add",
        "landing-sections.update",
        "landing-sections.remove"
      ],
      "components": [
        "LandingView",
        "LandingEditorView",
        "LandingSectionShell",
        "StatsSection",
        "TestimonialsSection",
        "FaqSection",
        "PricingSection",
        "NewsletterSection",
        "CustomSection"
      ],
      "utils": [
        "blankSection",
        "defaultLandingSections",
        "landingReducer",
        "parseConfigBadge",
        "parseConfigField",
        "parseConfigObject"
      ],
      "hooks": [
        "useLandingStore"
      ],
      "convex": {
        "tables": [],
        "rbac": []
      }
    }
  }
}
